J,"Su, WP; Sun, QP; Xia, MS; Wen, ZS; Yao, ZT",,,,"Su, Weiping; Sun, Qingping; Xia, Meisheng; Wen, Zhengshun; Yao, Zhitong",,,The Resource Utilization of Water Hyacinth (Eichhornia crassipes [Mart.] Solms) and Its Challenges,RESOURCES-BASEL,,,English,Review,,,,,,water hyacinth; anaerobic fermentation; compost; biogas; biomass,ANAEROBIC-DIGESTION; BIOGAS PRODUCTION; PLANT; NITROGEN; IMPACTS,"The unchecked growth of Eichhornia crassipes can cause significant harm, including covering of the water surface, depletion of oxygen, clogging of river channels, and promotion of the breeding of flies and mosquitoes. These effects can significantly impact farmland irrigation, water transportation, and human health. However, methods for controlling its growth are not ideal, and control using biological and chemical agents can result in secondary pollution. The utilization of E. crassipes as a resource, for example, as animal feed or organic substrates, can not only turn waste into valuable resources, but it can also solve the problem of its growth, thus bringing about economic and ecological benefits. In this paper, the growth and ecological characteristics of E. crassipes, its nutrient composition, and resource utilization approaches were reviewed. The challenges associated with the large-scale utilization of E. crassipes were also analyzed in order to provide references for the control and resource utilization of the species. Regarding challenges such as the difficulty of cultivation and the high cost of harvesting and dehydrating, it is necessary to investigate the proper water surface and coverage characteristics of E. crassipes cultivation to assure adequate biomass and protect the ecological landscape. It is also necessary to evaluate the effect of E. crassipes cultivation on the health of aquatic ecosystems and the safety of the water environment in order to prevent the significant potential ecological and environmental risks. In addition, developing portable, high-efficiency facilities to promote the effectiveness of harvesting, transportation and dehydration are needed, as well as further improvement in the techniques of utilization and assessment of the economic value.","[Su, Weiping; Yao, Zhitong] Hangzhou Dianzi Univ, Coll Mat Sci & Environm Engn, Hangzhou 310018, Zhejiang, Peoples R China; [Sun, Qingping] Yangzhou Sinomircro Biotech Ltd, Yangzhou 225107, Jiangsu, Peoples R China; [Xia, Meisheng] Zhejiang Univ, Ocean Coll, Zhoushan 316021, Peoples R China; [Wen, Zhengshun] Zhejiang Ocean Univ, Sch Food Sci & Pharmaceut, Zhoushan 316022, Peoples R China","Yao, ZT (corresponding author), Hangzhou Dianzi Univ, Coll Mat Sci & Environm Engn, Hangzhou 310018, Zhejiang, Peoples R China.",swp201309@163.com; sqp@163.com; msxia@zju.edu.cn; zswenmr@163.com; sxyzt@126.com,,,National Natural Science Foundation of ChinaNational Natural Science Foundation of China (NSFC) [51606055]; Key Laboratory for Solid Waste Management and Environment Safety Open Fund [SWMES 2017-01],This research was funded by the National Natural Science Foundation of China (Grant no. 51606055) and the Key Laboratory for Solid Waste Management and Environment Safety Open Fund (Grant no. SWMES 2017-01).,,47,5,5,0,7,MDPI,BASEL,"ST ALBAN-ANLAGE 66, CH-4052 BASEL, SWITZERLAND",2079-9276,,,RESOURCES-BASEL,Resources-Basel,SEP,2018,7,3,,,,,,,46,10.3390/resources7030046,,,9,Green & Sustainable Science & Technology,Science & Technology - Other Topics,GU3LE,WOS:000445178700008,,DOAJ Gold,,,2020-12-20,
J,"Bamou, R; Mbakop, LR; Kopya, E; Ndo, C; Awono-Ambene, P; Tchuinkam, T; Rono, MK; Mwangangi, J; Antonio-Nkondjio, C",,,,"Bamou, Roland; Mbakop, Lili Ranaise; Kopya, Edmond; Ndo, Cyrille; Awono-Ambene, Parfait; Tchuinkam, Timoleon; Rono, Martin Kibet; Mwangangi, Joseph; Antonio-Nkondjio, Christophe",,,Changes in malaria vector bionomics and transmission patterns in the equatorial forest region of Cameroon between 2000 and 2017,PARASITES & VECTORS,,,English,Article,,,,,,Malaria; Transmission; Equatorial forest region; Bionomic; Cameroon; LLINs; Anopheles,ANOPHELES-GAMBIAE; MOSQUITOS; CULICIDAE; DIPTERA; NETS,"Background: Increased use of long-lasting insecticidal nets (LLINs) over the last decade has considerably improved the control of malaria in sub-Saharan Africa. However, there is still a paucity of data on the influence of LLIN use and other factors on mosquito bionomics in different epidemiological foci. The objective of this study was to provide updated data on the evolution of vector bionomics and malaria transmission patterns in the equatorial forest region of Cameroon over the period 2000-2017, during which LLIN coverage has increased substantially. Methods: The study was conducted in Olama and Nyabessan, two villages situated in the equatorial forest region. Mosquito collections from 2016-2017 were compared to those of 2000-2001. Mosquitoes were sampled using both human landing catches and indoor sprays, and were identified using morphological taxonomic keys. Specimens belonging to the An. gambiae complex were further identified using molecular tools. Insecticide resistance bioassays were undertaken on An. gambiae to assess the susceptibility levels to both permethrin and deltamethrin. Mosquitoes were screened for Plasmodium falciparum infection and blood-feeding preference using the ELISA technique. Parasitological surveys in the population were conducted to determine the prevalence of Plasmodium infection using rapid diagnostic tests. Results: A change in the species composition of sampled mosquitoes was recorded between the 2000-2001 collections and those of 2016-2017. A drop in the density of the local primary vectors An. nili and An. moucheti in the forest region was recorded, whereas there was an increase in the density of An. gambiae (s.l.), An. marshallii, An. ziemannii and An. paludis. A change in the biting behaviour from indoor to outdoor was recorded in Olama. Very few indoor resting mosquitoes were collected. A change in the night biting cycle was recorded with mosquitoes displaying a shift from night biting to late evening/early in the night. Several mosquitoes were found positive for Plasmodium infection, thus sustaining continuous transmission of malaria in both sites. Reduction of malaria transmission in Nyabessan was lower than that seen in Olama and associated with deforestation and the construction of a dam that may have enabled a more efficient vector, An. gambiae (s.l.), to invade the area. A high level of resistance to pyrethroids (permethrin and deltamethrin) was detected for An. gambiae in both sites. High parasite prevalence was recorded in both sites, with children of 0-16 years being the most affected. In both Olama and Nyabessan, bed net usage appeared to correlate to protection against malaria infection. Conclusions: The study shows important changes in the bionomics of vector populations and malaria transmission patterns in the equatorial forest region. The changes call for more concerted efforts to address challenges such as insecticide resistance, environmental modifications or behavioural changes affecting the performance of current control measures.","[Bamou, Roland; Tchuinkam, Timoleon] Univ Dschang, Lab Appl Biol & Ecol VBID LABEA, Vector Borne Infect Dis Unit, Dept Anim Biol,Fac Sci, POB 067, Dschang, Cameroon; [Bamou, Roland; Mbakop, Lili Ranaise; Kopya, Edmond; Ndo, Cyrille; Awono-Ambene, Parfait; Antonio-Nkondjio, Christophe] Org Coordinat Lutte Endemies Afrique Cent OCEAC, Lab Rech Paludisme, BP 288, Yaounde, Cameroon; [Mbakop, Lili Ranaise; Kopya, Edmond] Univ Yaounde I, Fac Sci, POB 337, Yaounde, Cameroon; [Ndo, Cyrille] Univ Douala, Fac Med & Pharmaceut Sci, Dept Biol Sci, POB 24157, Douala, Cameroon; [Ndo, Cyrille; Antonio-Nkondjio, Christophe] Vector Biol Liverpool Sch Trop Med, Pembroke Pl, Liverpool L3 5QA, Merseyside, England; [Rono, Martin Kibet] KEMRI Wellcome Trust Res Programme, Ctr Geog Med Res Coast, Kilifi, Kenya; [Rono, Martin Kibet; Mwangangi, Joseph] KEMRI Ctr Geog Med Res Kilifi, Kilifi, Kenya; [Mwangangi, Joseph] Pwani Univ, Hlth & Res Inst, Kilifi, Kenya","Antonio-Nkondjio, C (corresponding author), Org Coordinat Lutte Endemies Afrique Cent OCEAC, Lab Rech Paludisme, BP 288, Yaounde, Cameroon.; Antonio-Nkondjio, C (corresponding author), Vector Biol Liverpool Sch Trop Med, Pembroke Pl, Liverpool L3 5QA, Merseyside, England.",antonio_nk@yahoo.fr,,"BAMOU, Roland/0000-0001-9031-1731; Rono, Martin/0000-0002-7255-821X",WHO TDR grant [2016/602099-0]; Wellcome Trust senior Fellowship in Public Health and Tropical Medicine [202687/Z/16/Z],"This work received financial support from WHO TDR grant 2016/602099-0 and Wellcome Trust senior Fellowship in Public Health and Tropical Medicine (202687/Z/16/Z) to CAN. The funding body did not have any role in the design, collection of data, analysis and interpretation of data, or in writing the manuscript.",,55,9,9,1,5,BMC,LONDON,"CAMPUS, 4 CRINAN ST, LONDON N1 9XW, ENGLAND",1756-3305,,,PARASITE VECTOR,Parasites Vectors,AUG 13,2018,11,,,,,,,,464,10.1186/s13071-018-3049-4,,,13,Parasitology; Tropical Medicine,Parasitology; Tropical Medicine,GQ1RU,WOS:000441416600003,30103825,"DOAJ Gold, Green Published, Green Accepted",,,2020-12-20,
J,"Michlmayr, D; Pak, TR; Rahman, AH; Amir, E; Kim, EY; Kim-Schulze, S; Suprun, M; Stewart, MG; Thomas, GP; Balmaseda, A; Wang, L; Zhu, J; Suarez-Farinas, M; Wolinsky, SM; Kasarskis, A; Harris, E",,,,"Michlmayr, Daniela; Pak, Theodore R.; Rahman, Adeeb H.; Amir, El-Ad David; Kim, Eun-Young; Kim-Schulze, Seunghee; Suprun, Maria; Stewart, Michael G.; Thomas, Guajira P.; Balmaseda, Angel; Wang, Li; Zhu, Jun; Suarez-Farinas, Mayte; Wolinsky, Steven M.; Kasarskis, Andrew; Harris, Eva",,,Comprehensive innate immune profiling of chikungunya virus infection in pediatric cases,MOLECULAR SYSTEMS BIOLOGY,,,English,Article,,,,,,chikungunya; CyTOF; immune profiling; pediatric; RNA-seq,T-CELL-ACTIVATION; DATA INTEGRATION; MOUSE MODEL; B-CELLS; EXPRESSION; MONOCYTES; ARTHRITIS; IMMUNOLOGY; CYTOKINES; HETEROGENEITY,"Chikungunya virus (CHIKV) is a mosquito-borne alphavirus that causes global epidemics of debilitating disease worldwide. To gain functional insight into the host cellular genes required for virus infection, we performed whole-blood RNA-seq, 37-plex mass cytometry of peripheral blood mononuclear cells (PBMCs), and serum cytokine measurements of acute- and convalescent-phase samples obtained from 42 children naturally infected with CHIKV. Semi-supervised classification and clustering of single-cell events into 57 sub-communities of canonical leukocyte phenotypes revealed a monocyte-driven response to acute infection, with the greatest expansions in intermediate CD14(++)CD16(+) monocytes and an activated subpopulation of CD14(+) monocytes. Increases in acute- phase CHIKV envelope protein E2 expression were highest for monocytes and dendritic cells. Serum cytokine measurements confirmed significant acute- phase upregulation of monocyte chemoattractants. Distinct transcriptomic signatures were associated with infection timepoint, as well as convalescent-phase anti-CHIKV antibody titer, acute- phase viremia, and symptom severity. We present a multiscale network that summarizes all observed modulations across cellular and transcriptomic levels and their interactions with clinical outcomes, providing a uniquely global view of the biomolecular landscape of human CHIKV infection.","[Michlmayr, Daniela; Harris, Eva] Univ Calif Berkeley, Sch Publ Hlth, Div Infect Dis & Vaccinol, Berkeley, CA 94720 USA; [Pak, Theodore R.; Rahman, Adeeb H.; Amir, El-Ad David; Kim-Schulze, Seunghee; Wang, Li; Zhu, Jun; Suarez-Farinas, Mayte; Kasarskis, Andrew] Icahn Sch Med Mt Sinai, Dept Genet & Genom Sci, New York, NY 10029 USA; [Rahman, Adeeb H.; Amir, El-Ad David; Kim-Schulze, Seunghee] Icahn Sch Med Mt Sinai, Human Immune Monitoring Ctr, New York, NY 10029 USA; [Kim, Eun-Young; Stewart, Michael G.; Thomas, Guajira P.; Wolinsky, Steven M.] Northwestern Univ, Dept Med, Feinberg Sch Med, Div Infect Dis, Chicago, IL 60611 USA; [Suprun, Maria; Suarez-Farinas, Mayte] Icahn Sch Med Mt Sinai, Dept Populat Hlth & Sci Policy, New York, NY 10029 USA; [Balmaseda, Angel] Minist Salud, Ctr Nacl Diagnost & Referencia, Lab Nacl Virol, Managua, Nicaragua","Harris, E (corresponding author), Univ Calif Berkeley, Sch Publ Hlth, Div Infect Dis & Vaccinol, Berkeley, CA 94720 USA.",eharris@berkeley.edu,"Wolinsky, Steven/B-2893-2012; Suprun, Maria/ABE-8323-2020","Suprun, Maria/0000-0001-9161-4021; Kim, Eunyoung/0000-0002-7436-7396","NIH/NIAIDUnited States Department of Health & Human ServicesNational Institutes of Health (NIH) - USANIH National Institute of Allergy & Infectious Diseases (NIAID) [U19AI118610, R33AI100186, F30AI122673]; NATIONAL INSTITUTE OF ALLERGY AND INFECTIOUS DISEASESUnited States Department of Health & Human ServicesNational Institutes of Health (NIH) - USANIH National Institute of Allergy & Infectious Diseases (NIAID) [U19AI118610, U19AI118610, F30AI122673, U19AI118610, U19AI118610, U19AI118610, U19AI118610, U19AI118610, U19AI118610, U19AI118610, U19AI118610, U19AI118610, U19AI118610, U19AI118610, U19AI118610, U19AI118610, F30AI122673, U19AI118610, U19AI118610, U19AI118610, U19AI118610, U19AI118610, U19AI118610, U19AI118610, U19AI118610, U19AI118610, U19AI118610, U19AI118610, U19AI118610, U19AI118610, U19AI118610, U19AI118610, U19AI118610, U19AI118610, U19AI118610, U19AI118610, U19AI118610, U19AI118610, U19AI118610, R33AI100186, R33AI100186, U19AI118610, U19AI118610, U19AI118610, U19AI118610, U19AI118610, U19AI118610, U19AI118610, U19AI118610, U19AI118610, U19AI118610, R33AI100186, U19AI118610, U19AI118610, U19AI118610, U19AI118610, U19AI118610, R33AI100186, U19AI118610, U19AI118610, U19AI118610, U19AI118610, U19AI118610, U19AI118610, U19AI118610, U19AI118610, U19AI118610, U19AI118610, U19AI118610, U19AI118610, U19AI118610, U19AI118610, U19AI118610, F30AI122673, U19AI118610] Funding Source: NIH RePORTER","This work was supported by NIH/NIAID grants U19AI118610 (DM, TRP, AR, E-YK, SK-S, AB, MS-F, SW, AK, EH), R33AI100186 (AB, EH), and F30AI122673 (TRP), and in part by the resources and expertise of the Department of Scientific Computing at the Icahn School of Medicine at Mount Sinai. We thank Jesse Waggoner for advice regarding quantifying CHIKV viremia in patient samples. We thank study personnel at the HIMJR and the National Virology Laboratory of the Ministry of Health in Managua, Nicaragua, for enrolling patients, collecting blood samples and clinical data, maintaining databases and a high level of quality control, and preparing PBMCs. We are grateful to the study participants and their families.",,111,25,26,0,4,WILEY,HOBOKEN,"111 RIVER ST, HOBOKEN 07030-5774, NJ USA",1744-4292,,,MOL SYST BIOL,Mol. Syst. Biol.,AUG,2018,14,8,,,,,,,e7862,10.15252/msb.20177862,,,25,Biochemistry & Molecular Biology,Biochemistry & Molecular Biology,GT5JR,WOS:000444544200001,30150281,"DOAJ Gold, Green Published",,,2020-12-20,
J,"Komar, N; Panella, NA; Golnar, AJ; Hamer, GL",,,,"Komar, Nicholas; Panella, Nicholas A.; Golnar, Andrew J.; Hamer, Gabriel L.",,,"Forage Ratio Analysis of the Southern House Mosquito in College Station, Texas",VECTOR-BORNE AND ZOONOTIC DISEASES,,,English,Article,,,,,,southern house mosquito; West Nile virus; forage ratio; reservoir capacity,WEST-NILE-VIRUS; HOST-FEEDING PATTERNS; EXPERIMENTAL-INFECTION; AVIAN HOSTS; BIRDS; CULICIDAE; DIPTERA; VECTOR; EPIDEMIOLOGY; OUTBREAK,"Culex quinquefasciatus is the principal vector of West Nile virus (WNV) in the South Central United States, yet limited data on host utilization are available. We evaluated host utilization over a 3-month period in 2013 in a residential landscape in College Station, Texas. PCR sequencing of the mitochondrial cytochrome oxidase 1 gene permitted molecular identification of vertebrate bloodmeals to the species level. Forage ratio analysis identified bird species that were overutilized and underutilized by comparing community feeding index values to expected relative abundance values of bird species, derived from eBird data. Community feeding index values were also used in conjunction with reservoir competence data from the literature to generate reservoir capacity index values, a means of identifying relative importance of vertebrate reservoir hosts. Of 498 blood-engorged Cx. quinquefasciatus, 313 (62.9%) were identified to vertebrate species. The majority (95.5%) of bloodmeals originated from avian species with the remainder from mammals, but not humans. Northern mockingbird (Mimus polyglottos) was the principal host for mosquito feeding in June and July, but northern cardinal (Cardinalis cardinalis) became primary host in August. Forage ratio analysis revealed the overutilization of house finch (Haemorhous mexicanus), American robin (Turdus migratorius), northern mockingbird, northern cardinal, white-winged dove (Zenaida asiatica), and mourning dove (Zenaida macroura). Great-tailed grackle (Quiscalus mexicanus), blue jay (Cyanocitta cristata), and Carolina wren (Thryothorus ludovicianus) were under-utilized relative to availability. Reservoir capacity calculations suggested that northern mockingbird and northern cardinal were the principal amplifiers in the study area. These data identify the primary avian species contributing to the enzootic amplification of WNV in East-Central Texas and reveal that the heavy feeding on moderately competent hosts and no feeding on humans likely limit epidemics in this region.","[Komar, Nicholas; Panella, Nicholas A.] Ctr Dis Control & Prevent, Div Vector Borne Dis, 3150 Rampart Rd, Ft Collins, CO 80521 USA; [Golnar, Andrew J.; Hamer, Gabriel L.] Texas A&M Univ, Dept Entomol, TAMU 2475, College Stn, TX 77843 USA","Komar, N (corresponding author), Ctr Dis Control & Prevent, Div Vector Borne Dis, 3150 Rampart Rd, Ft Collins, CO 80521 USA.",nkomar@cdc.gov,,,Mosquito Research Foundation; Centers for Disease Control and PreventionUnited States Department of Health & Human ServicesCenters for Disease Control & Prevention - USA,"We thank the numerous residents of households in College Station, Texas, that granted us permission to trap mosquitoes on their property. Field and mosquito processing assistance were provided by Emily Boothe, Michael Sanders, Chris Tarrand, Sarah Noe, and Tim Foreman. We appreciate the power of eBird to generate avian relative abundance data, and the hundreds of local citizen science observerswho contributed these data. Funding for mosquito collections was provided by the Mosquito Research Foundation. Laboratory testing was funded by the Centers for Disease Control and Prevention.",,26,4,4,2,3,"MARY ANN LIEBERT, INC",NEW ROCHELLE,"140 HUGUENOT STREET, 3RD FL, NEW ROCHELLE, NY 10801 USA",1530-3667,1557-7759,,VECTOR-BORNE ZOONOT,Vector-Borne Zoonotic Dis.,SEP,2018,18,9,,,,,485,490,,10.1089/vbz.2018.2285,,JUN 2018,6,"Public, Environmental & Occupational Health; Infectious Diseases","Public, Environmental & Occupational Health; Infectious Diseases",GT3KY,WOS:000435744400001,29920164,,,,2020-12-20,
J,"Brown, R; Hing, CT; Fornace, K; Ferguson, HM",,,,"Brown, Rebecca; Hing, Chua Tock; Fornace, Kimberly; Ferguson, Heather M.",,,"Evaluation of resting traps to examine the behaviour and ecology of mosquito vectors in an area of rapidly changing land use in Sabah, Malaysian Borneo",PARASITES & VECTORS,,,English,Article,,,,,,Resting behaviour; Sticky traps; Exophily; Zoonosis; Blood meal identification,PLASMODIUM-KNOWLESI; ANOPHELES-GAMBIAE; HOST-SEEKING; WUCHERERIA-BANCROFTI; MALARIA TRANSMISSION; ARBOVIRUS INFECTIONS; INCREASING INCIDENCE; FALCIPARUM-MALARIA; WESTERN KENYA; ENDEMIC AREA,"Background: Widespread deforestation occurring in the tropics is hypothesized to impact the transmission of vector-borne diseases (VBD). Predicting how environmental changes will impact VBD transmission is dependent on understanding the ecology and behaviour of potential vector species outside of domestic settings. However there are few reliable sampling tools for measuring the habitat preference and host choice of mosquito vectors; with almost none suitable for sampling recently blood-fed, resting mosquitoes. This study evaluated the use of two mosquito traps: the resting bucket (RB) and sticky resting bucket (SRB) traps relative to CDC backpack aspiration (CDC) for sampling mosquitoes resting in a range of habitats representing a gradient of deforestation. Eight habitats were selected for sampling around two villages in Kudat District, Malaysian Borneo, to reflect the range of habitats available to mosquitoes in and around human dwellings, and nearby forest habitats where reservoir hosts are present: secondary forest (edge, interior and canopy); plantations (palm and rubber); and human settlements (inside, under and around houses). Results: Over 31 days, 2243 mosquitoes were collected in 5748 discrete collections. Nine mosquito genera were sampled with Aedes and Culex species being present in all habitats and most abundant. RB and CDC backpack aspiration were most efficient for sampling Culex whereas CDC backpack aspiration and SRB were most efficient for Aedes. Most Aedes identified to species level were Ae. albopictus (91%), with their abundance being highest in forest edge habitats. In contrast, Culex were most abundant under houses. Most blood-fed mosquitoes (76%) were found in human settlements; with humans and chickens being the only blood source. Conclusions: RB and SRB traps proved capable of sampling mosquitoes resting in all sampled habitats. However, sampling efficiency was generally low (c.0.1 per trap per day), necessitating traps to be deployed in high numbers for mosquito detection. None of the traps were effective for sampling zoonotic malaria vectors; however, SRB collected relatively higher numbers of the dengue vector Ae. albopictus. The higher abundance of mosquitoes in forest edge habitats indicates the potential value of these traps for investigating sylvatic dengue transmission. This study has demonstrated the merits in application of simple resting traps for characterising mosquito vector resting behaviour outside of the home.","[Brown, Rebecca; Ferguson, Heather M.] Univ Glasgow, Coll Med Vet & Life Sci, Inst Biodivers Anim Hlth & Comparat Med, Glasgow G12 8QQ, Lanark, Scotland; [Hing, Chua Tock] Univ Malaysia Sabah, Fac Med & Hlth Sci, Dept Pathobiol & Med Diagnost, Kota Kinabalu 88400, Sabah, Malaysia; [Fornace, Kimberly] London Sch Hyg & Trop Med, Fac Infect & Trop Dis, London WC1E 7HT, England","Brown, R (corresponding author), Univ Glasgow, Coll Med Vet & Life Sci, Inst Biodivers Anim Hlth & Comparat Med, Glasgow G12 8QQ, Lanark, Scotland.",r.brown.3@research.gla.ac.uk,"Chua, Tock H/E-4157-2012; Fornace, Kimberly/ABF-7147-2020","Chua, Tock H/0000-0002-8984-8723; Fornace, Kimberly/0000-0002-5484-241X; Ferguson, Heather/0000-0002-9625-5176",British Biological Sciences Research Council (BBSRC DTP) [BB/J013854/1]; MonkeyBar Project (UK Research Councils Environmental and Social Ecology of Human Infectious Diseases Initiative (ESEI)) [G1100796],"This research was funded by the British Biological Sciences Research Council (BBSRC DTP, grant ref: BB/J013854/1) and in collaboration with the MonkeyBar Project (UK Research Councils Environmental and Social Ecology of Human Infectious Diseases Initiative (ESEI): G1100796).",,93,5,5,0,17,BMC,LONDON,"CAMPUS, 4 CRINAN ST, LONDON N1 9XW, ENGLAND",1756-3305,,,PARASITE VECTOR,Parasites Vectors,JUN 14,2018,11,,,,,,,,346,10.1186/s13071-018-2926-1,,,15,Parasitology; Tropical Medicine,Parasitology; Tropical Medicine,GJ4TV,WOS:000435375800002,29898780,"DOAJ Gold, Green Published, Green Accepted",,,2020-12-20,
