J,"Steiger, DBM; Ritchie, SA; Laurance, SGW",,,,"Steiger, Dagmar B. Meyer; Ritchie, Scott Alex; Laurance, Susan G. W.",,,Land Use Influences Mosquito Communities and Disease Risk on Remote Tropical Islands: A Case Study Using a Novel Sampling Technique,AMERICAN JOURNAL OF TROPICAL MEDICINE AND HYGIENE,,,English,Article,,,,,,,L-LACTIC ACID; JAPANESE ENCEPHALITIS; AEDES-ALBOPICTUS; MALARIA MOSQUITO; FEEDING PATTERNS; CARBON-DIOXIDE; TORRES STRAIT; ROSS RIVER; DENGUE; AUSTRALIA,"Land use changes, such as deforestation and urbanization, can influence interactions between vectors, hosts, and pathogens. The consequences may result in the appearance and rise of mosquito-borne diseases, especially in remote tropical regions. Tropical regions can be the hotspots for the emergence of diseases due to high biological diversity and complex species interactions. Furthermore, frontier areas are often haphazardly surveyed as a result of inadequate or expensive sampling techniques, which limit early detection and medical intervention. We trialed a novel sampling technique of nonpowered traps and a carbon dioxide attractant derived from yeast and sugar to explore how land use influences mosquito communities on four remote, tropical islands in the Australian Torres Strait. Using this technique, we collected > 11,000 mosquitoes from urban and sylvan habitats. We found that human land use significantly affected mosquito communities. Mosquito abundances and diversity were higher in sylvan habitats compared with urban areas, resulting in significantly different community compositions between the two habitats. An important outcome of our study was determining that there were greater numbers of disease-vectoring species associated with human habitations. On the basis of these findings, we believe that our novel sampling technique is a realistic tool for assessing mosquito communities in remote regions.","[Steiger, Dagmar B. Meyer] James Cook Univ, Ctr Trop Environm & Sustainabil Studies, Cairns, Qld 4870, Australia; James Cook Univ, Coll Marine & Environm Sci, Cairns, Qld 4870, Australia; James Cook Univ, Sch Publ Hlth Trop Med & Rehabil Sci, Cairns, Qld 4870, Australia","Steiger, DBM (corresponding author), James Cook Univ, Ctr Trop Environm & Sustainabil Studies, Cairns, Qld 4870, Australia.",dagmar.meyersteiger@my.jcu.edu.au,"Laurance, Susan/G-6021-2011","Laurance, Susan/0000-0002-2831-2933; Meyer Steiger, Dagmar/0000-0002-0938-5395",Australian Postgraduate AwardAustralian Government; Torres Strait Regional Authority; National Environmental Research Program; James Cook University; Reef and Rainforest Research Centre; Australian Research CouncilAustralian Research Council,"This research was supported by an Australian Postgraduate Award to DBM, and grants to SGWL from the Torres Strait Regional Authority, National Environmental Research Program, James Cook University, Reef and Rainforest Research Centre, and the Australian Research Council Future Fellowship.",,59,4,4,1,30,AMER SOC TROP MED & HYGIENE,MCLEAN,"8000 WESTPARK DR, STE 130, MCLEAN, VA 22101 USA",0002-9637,1476-1645,,AM J TROP MED HYG,Am. J. Trop. Med. Hyg.,FEB,2016,94,2,,,,,314,321,,10.4269/ajtmh.15-0161,,,8,"Public, Environmental & Occupational Health; Tropical Medicine","Public, Environmental & Occupational Health; Tropical Medicine",DC8JK,WOS:000369465500012,26711512,"Green Published, Bronze",,,2020-12-20,
J,"Sehgal, RNM",,,,"Sehgal, Ravinder N. M.",,,Manifold habitat effects on the prevalence and diversity of avian blood parasites,INTERNATIONAL JOURNAL FOR PARASITOLOGY-PARASITES AND WILDLIFE,,,English,Review,,,,,,,MALARIA PLASMODIUM-RELICTUM; CLIMATE-CHANGE; HOST-SPECIFICITY; WILD BIRDS; FOREST; DEFORESTATION; HAEMOSPORIDA; VECTOR; MOSQUITOS; PATTERNS,"Habitats are rapidly changing across the planet and the consequences will have major and long-lasting effects on wildlife and their parasites. Birds harbor many types of blood parasites, but because of their relatively high prevalence and ease of diagnosis, it is the haemosporidians - Plasmodium, Haemoproteus, and Leucocytozoon - that are the best studied in terms of ecology and evolution. For parasite transmission to occur, environmental conditions must be permissive, and given the many constraints on the competency of parasites, vectors and hosts, it is rather remarkable that these parasites are so prevalent and successful. Over the last decade, a rapidly growing body of literature has begun to clarify how environmental factors affect birds and the insects that vector their hematozoan parasites. Moreover, several studies have modeled how anthropogenic effects such as global climate change, deforestation and urbanization will impact the dynamics of parasite transmission. This review highlights recent research that impacts our understanding of how habitat and environmental changes can affect the distribution, diversity, prevalence and parasitemia of these avian blood parasites. Given the importance of environmental factors on transmission, it remains essential that researchers studying avian hematozoa document abiotic factors such as temperature, moisture and landscape elements. Ultimately, this continued research has the potential to inform conservation policies and help avert the loss of bird species and threatened habitats. (C) 2015 The Author. Published by Elsevier Ltd on behalf of Australian Society for Parasitology.","[Sehgal, Ravinder N. M.] San Francisco State Univ, Dept Biol, 1600 Holloway Ave, San Francisco, CA 94132 USA","Sehgal, RNM (corresponding author), San Francisco State Univ, Dept Biol, 1600 Holloway Ave, San Francisco, CA 94132 USA.",sehgal@sfsu.edu,,,,,,123,58,59,2,30,ELSEVIER,AMSTERDAM,"RADARWEG 29, 1043 NX AMSTERDAM, NETHERLANDS",2213-2244,,,INT J PARASITOL-PAR,Int. J. Parasitol.-Parasit. Wildl.,DEC,2015,4,3,,,,,421,430,,10.1016/j.ijppaw.2015.09.001,,,10,Ecology; Parasitology,Environmental Sciences & Ecology; Parasitology,DF6BV,WOS:000371441100021,26835250,"DOAJ Gold, Green Published",,,2020-12-20,
J,"Reiner, RC; Guerra, C; Donnelly, MJ; Bousema, T; Drakeley, C; Smith, DL",,,,"Reiner, Robert C., Jr.; Guerra, Carlos; Donnelly, Martin J.; Bousema, Teun; Drakeley, Chris; Smith, David L.",,,Estimating malaria transmission from humans to mosquitoes in a noisy landscape,JOURNAL OF THE ROYAL SOCIETY INTERFACE,,,English,Article,,,,,,disease ecology; infectious disease dynamics; mosquito-borne pathogen; non-Markovian dynamics,PLASMODIUM-FALCIPARUM TRANSMISSION; ENVIRONMENTAL NOISE; POPULATION-DYNAMICS; ELIMINATION; RATES; COLOR; STRATEGIES; VACCINES; AFRICA; MODEL,"A basic quantitative understanding of malaria transmission requires measuring the probability a mosquito becomes infected after feeding on a human. Parasite prevalence in mosquitoes is highly age-dependent, and the unknown age-structure of fluctuating mosquito populations impedes estimation. Here, we simulate mosquito infection dynamics, where mosquito recruitment is modelled seasonally with fractional Brownian noise, and we develop methods for estimating mosquito infection rates. We find that noise introduces bias, but the magnitude of the bias depends on the 'colour' of the noise. Some of these problems can be overcome by increasing the sampling frequency, but estimates of transmission rates (and estimated reductions in transmission) are most accurate and precise if they combine parity, oocyst rates and sporozoite rates. These studies provide a basis for evaluating the adequacy of various entomological sampling procedures for measuring malaria parasite transmission from humans to mosquitoes and for evaluating the direct transmission-blocking effects of a vaccine.","[Reiner, Robert C., Jr.; Smith, David L.] NIH, Fogarty Int Ctr, Bethesda, MD 20892 USA; [Reiner, Robert C., Jr.] Univ Calif Davis, Dept Entomol, Davis, CA 95616 USA; [Reiner, Robert C., Jr.] Indiana Univ, Dept Epidemiol & Biostat, Bloomington, IN USA; [Guerra, Carlos] Ctr Dis Dynam Econ & Policy, Washington, DC USA; [Donnelly, Martin J.] Univ Liverpool, Liverpool Sch Trop Med, Dept Vector Biol, Liverpool L3 5QA, Merseyside, England; [Donnelly, Martin J.] Wellcome Trust Sanger Inst, Malaria Programme, Cambridge, England; [Bousema, Teun; Drakeley, Chris] London Sch Hyg & Trop Med, Dept Immunol & Infect, London WC1, England; [Bousema, Teun] Radboud Univ Nijmegen, Med Ctr, Dept Med Microbiol, NL-6525 ED Nijmegen, Netherlands; [Smith, David L.] Sanaria Inst Global Hlth & Trop Med, Rockville, MD USA; [Smith, David L.] Univ Oxford, Dept Zool, Oxford OX1 3PS, England; [Smith, David L.] Univ Washington, Inst Hlth Metr & Evaluat, Seattle, WA 98195 USA","Reiner, RC (corresponding author), NIH, Fogarty Int Ctr, Bldg 10, Bethesda, MD 20892 USA.",rcreiner@indiana.edu,"Smith, David L/L-8850-2013; Bousema, Teun/N-3574-2014","Smith, David L/0000-0003-4367-3849; Bousema, Teun/0000-0003-2666-094X; Donnelly, Martin/0000-0001-5218-1497","Malaria Vaccine Initiative; Research and Policy for Infectious Disease Dynamics (RAPIDD) programme of the Science and Technology Directorate; Department of Homeland SecurityUnited States Department of Homeland Security (DHS); Fogarty International Center, National Institutes of HealthUnited States Department of Health & Human ServicesNational Institutes of Health (NIH) - USANIH Fogarty International Center (FIC); Bill & Melinda Gates FoundationBill & Melinda Gates Foundation [OPP1110495, OPP1034789]; National Institutes of Health/National Institute of Allergy and Infectious DiseasesUnited States Department of Health & Human ServicesNational Institutes of Health (NIH) - USANIH National Institute of Allergy & Infectious Diseases (NIAID) [U19AI089674]; European Research CouncilEuropean Research Council (ERC) [ERC-2014-StG 639776]; NATIONAL CENTER FOR ADVANCING TRANSLATIONAL SCIENCESUnited States Department of Health & Human ServicesNational Institutes of Health (NIH) - USANIH National Center for Advancing Translational Sciences (NCATS) [UL1TR001108, UL1TR002529, UL1TR001108, UL1TR001108, UL1TR001108, UL1TR001108, UL1TR001108, UL1TR001108] Funding Source: NIH RePORTER; NATIONAL INSTITUTE OF ALLERGY AND INFECTIOUS DISEASESUnited States Department of Health & Human ServicesNational Institutes of Health (NIH) - USANIH National Institute of Allergy & Infectious Diseases (NIAID) [U19AI089674, U19AI089674, U19AI089674, U19AI089674, U19AI089674, U19AI089674, U19AI089674, U19AI089674, U19AI089674, U19AI089674, U19AI089674, U19AI089674, U19AI089674, U19AI089674, U19AI089674, U19AI089674, U19AI089674, U19AI089674, U19AI089674, U19AI089674, U19AI089674, U19AI089674, U19AI089674, U19AI089674, U19AI089674, U19AI089674, U19AI089674, U19AI089674, U19AI089674, U19AI089674, U19AI089674, U19AI089674, U19AI089674, U19AI089674, U19AI089674, U19AI089674, U19AI089674, U19AI089674, U19AI089674, U19AI089674, U19AI089674, U19AI089674, U19AI089674, U19AI089674, U19AI089674, U19AI089674, U19AI089674, U19AI089674, U19AI089674, U19AI089674, U19AI089674, U19AI089674, U19AI089674, U19AI089674, U19AI089674, U19AI089674, U19AI089674, U19AI089674, U19AI089674, U19AI089674, U19AI089674, U19AI089674, U19AI089674, U19AI089674, U19AI089674, U19AI089674, U19AI089674, U19AI089674, U19AI089674, U19AI089674, U19AI089674, U19AI089674, U19AI089674, U19AI089674, U19AI089674, U19AI089674, U19AI089674] Funding Source: NIH RePORTER","R.C.R. and D.L.S. acknowledge funding from the Malaria Vaccine Initiative and from the Research and Policy for Infectious Disease Dynamics (RAPIDD) programme of the Science and Technology Directorate, Department of Homeland Security, and the Fogarty International Center, National Institutes of Health as well as funding from the Bill & Melinda Gates Foundation (grant no. OPP1110495). D.L.S., M.J.D. and C.D. acknowledge funding from National Institutes of Health/National Institute of Allergy and Infectious Diseases (U19AI089674). T.B. acknowledges funding from the Bill & Melinda Gates Foundation (OPP1034789) and the European Research Council (ERC-2014-StG 639776).",,52,4,4,0,7,ROYAL SOC,LONDON,"6-9 CARLTON HOUSE TERRACE, LONDON SW1Y 5AG, ENGLAND",1742-5689,1742-5662,,J R SOC INTERFACE,J. R. Soc. Interface,OCT 6,2015,12,111,,,,,,,20150478,10.1098/rsif.2015.0478,,,10,Multidisciplinary Sciences,Science & Technology - Other Topics,CU4HE,WOS:000363487600005,26400195,"Green Published, Green Accepted, Other Gold",,,2020-12-20,
J,"Gudex-Cross, D; Barraclough, RK; Brunton, DH; Derraik, JGB",,,,"Gudex-Cross, David; Barraclough, Rosemary K.; Brunton, Dianne H.; Derraik, Jose G. B.",,,Mosquito Communities and Avian Malaria Prevalence in Silvereyes (Zosterops lateralis) Within Forest Edge and Interior Habitats in a New Zealand Regional Park,ECOHEALTH,,,English,Article,,,,,,Culicidae; Plasmodium; forest; habitat fragmentation; canopy; height; prevalence,CULEX-QUINQUEFASCIATUS DIPTERA; AUCKLAND REGION; ENVIRONMENTAL-CHANGE; BLOOD PARASITES; PLASMODIUM SPP.; NATIVE FOREST; CULICIDAE; PATTERNS; ECOLOGY; IDENTIFICATION,"Forest fragmentation and agricultural development are important anthropogenic landscape alterations affecting the disease dynamics of malarial parasites (Plasmodium spp.), largely through their effects on vector communities. We compared vector abundance and species composition at two forest edge sites abutting pastureland and two forest interior sites in New Zealand, while simultaneously assessing avian malaria prevalence in silvereyes (Zosterops lateralis). Twenty-two of 240 (9.2%) individual silvereyes captured across all sites tested positive for avian malaria, and Plasmodium prevalence was nearly identical in edge and interior habitats. A total of 580 mosquito specimens were trapped across all sites. These comprised five different species: the introduced Aedes notoscriptus and Culex quinquefasciatus; the native A. antipodeus, C. asteliae and C. pervigilans. The known avian malaria vector C. quinquefasciatus was only recorded in the forest edge (mostly at ground level). In contrast, the probable vector C. pervigilans was abundant and widespread in both edge and interior sites. Although frequently caught in ground traps, more C. pervigilans specimens were captured in the canopy. This study shows that avian malaria prevalence among silvereyes appeared to be unaffected by forest fragmentation, at least at the scale assessed. Introduced mosquito species were almost completely absent from the forest interior, and thus our study provides further circumstantial evidence that native mosquito species (in particular C. pervigilans) play an important role in avian malaria transmission in New Zealand.","[Gudex-Cross, David; Barraclough, Rosemary K.; Brunton, Dianne H.] Massey Univ, Inst Nat Sci, Auckland, New Zealand; [Derraik, Jose G. B.] Univ Auckland, Liggins Inst, Auckland 1142, New Zealand; [Gudex-Cross, David] Univ Vermont, Rubenstein Sch Environm & Nat Resources, Burlington, VT USA; [Barraclough, Rosemary K.] Univ Auckland, Sch Biol Sci, Auckland 1142, New Zealand","Derraik, JGB (corresponding author), Univ Auckland, Liggins Inst, Private Bag 92019, Auckland 1142, New Zealand.",j.derraik@auckland.ac.nz,"Derraik, Jose Guilherme Behrensdorf/A-1925-2008","Derraik, Jose Guilherme Behrensdorf/0000-0003-1226-1956; Gudex-Cross, David/0000-0001-6939-7753",Auckland Council; Massey University,"The authors would like to thank Tim Lovegrove and the Auckland Council for their help in funding field equipment purchases and providing lodging at Waharau. In addition, we thank Karli Stevens, Remi Bigonneau, Cecile Houlle , Ria Brejaart and the EcoQuest volunteers, for dedicating their time to help us in the field. This study was funded by Massey University and the Auckland Council.",,54,4,4,1,22,SPRINGER,NEW YORK,"ONE NEW YORK PLAZA, SUITE 4600, NEW YORK, NY, UNITED STATES",1612-9202,1612-9210,,ECOHEALTH,EcoHealth,SEP,2015,12,3,,,,,432,440,,10.1007/s10393-015-1039-y,,,9,Biodiversity Conservation; Ecology; Environmental Sciences,Biodiversity & Conservation; Environmental Sciences & Ecology,CU7MH,WOS:000363723300007,26065670,Bronze,,,2020-12-20,
J,"van Breugel, F; Riffell, J; Fairhall, A; Dickinson, MH",,,,"van Breugel, Floris; Riffell, Jeff; Fairhall, Adrienne; Dickinson, Michael H.",,,Mosquitoes Use Vision to Associate Odor Plumes with Thermal Targets,CURRENT BIOLOGY,,,English,Article,,,,,,,AEDES-AEGYPTI DIPTERA; HUMAN SKIN ODOR; CARBON-DIOXIDE; ANOPHELES-GAMBIAE; HOST; RESPONSES; CULICIDAE; DROSOPHILA; TRACKING; STIMULI,"All moving animals, including flies [1-3], sharks [4], and humans [5], experience a dynamic sensory landscape that is a function of both their trajectory through space and the distribution of stimuli in the environment. This is particularly apparent for mosquitoes, which use a combination of olfactory, visual, and thermal cues to locate hosts [6-10]. Mosquitoes are thought to detect suitable hosts by the presence of a sparse CO2 plume, which they track by surging upwind and casting crosswind [11]. Upon approach, local cues such as heat and skin volatiles help them identify a landing site [12-15]. Recent evidence suggests that thermal attraction is gated by the presence of CO2 [6], although this conclusion was based experiments in which the actual flight trajectories of the animals were unknown and visual cues were not studied. Using a three-dimensional tracking system, we show that rather than gating heat sensing, the detection of CO2 actually activates a strong attraction to visual features. This visual reflex guides the mosquitoes to potential hosts where they are close enough to detect thermal cues. By experimentally decoupling the olfactory, visual, and thermal cues, we show that the motor reactions to these stimuli are independently controlled. Given that humans become visible to mosquitoes at a distance of 5-15 m [16], visual cues play a critical intermediate role in host localization by coupling long-range plume tracking to behaviors that require short-range cues. Rather than direct neural coupling, the separate sensory-motor reflexes are linked as a result of the interaction between the animal's reactions and the spatial structure of the stimuli in the environment.","[van Breugel, Floris; Dickinson, Michael H.] CALTECH, Div Biol & Bioengn, Pasadena, CA 91125 USA; [Riffell, Jeff] Univ Washington, Dept Biol, Seattle, WA 98195 USA; [Fairhall, Adrienne] Univ Washington, Dept Biophys, Seattle, WA 98195 USA","van Breugel, F (corresponding author), CALTECH, Div Biol & Bioengn, 1200 East Calif Blvd, Pasadena, CA 91125 USA.",floris@caltech.edu; flyman@caltech.edu,,,"NIHUnited States Department of Health & Human ServicesNational Institutes of Health (NIH) - USA [NIH1RO1DCO13693-01]; NATIONAL INSTITUTE ON DEAFNESS AND OTHER COMMUNICATION DISORDERSUnited States Department of Health & Human ServicesNational Institutes of Health (NIH) - USANIH National Institute on Deafness & Other Communication Disorders (NIDCD) [R01DC013693, R01DC013693, R01DC013693, R01DC013693, R01DC013693] Funding Source: NIH RePORTER","We thank A. Straw for help with the three-dimensional tracking software, C. Vinauger and B. Nguyen for help with raising the mosquitos, and members of the M.H.D. lab for experimental and manuscript feedback. This work was funded by NIH grant NIH1RO1DCO13693-01.",,36,90,90,1,51,CELL PRESS,CAMBRIDGE,"600 TECHNOLOGY SQUARE, 5TH FLOOR, CAMBRIDGE, MA 02139 USA",0960-9822,1879-0445,,CURR BIOL,Curr. Biol.,AUG 17,2015,25,16,,,,,2123,2129,,10.1016/j.cub.2015.06.046,,,7,Biochemistry & Molecular Biology; Biology; Cell Biology,Biochemistry & Molecular Biology; Life Sciences & Biomedicine - Other Topics; Cell Biology,CP4WB,WOS:000359882200023,26190071,"Green Accepted, Bronze",,,2020-12-20,
J,"Khazan, ES; Bright, EG; Beyer, JE",,,,"Khazan, Emily S.; Bright, Eric G.; Beyer, Jessica E.",,,Land management impacts on tree hole invertebrate communities in a Neotropical rainforest,JOURNAL OF INSECT CONSERVATION,,,English,Article,,,,,,"Phytotelmata; Invertebrate community; Land management; Neotropics; Los Tuxtlas, Mexico; Mosquito vector",LOS-TUXTLAS; FEEDING ECOLOGY; CHIRONOMIDAE DIPTERA; INFECTIOUS-DISEASE; WATER; PHYTOTELMATA; FRAGMENTATION; DEFORESTATION; BIODIVERSITY; ASSEMBLAGES,"The Los Tuxtlas Biosphere Reserve in Southeastern Veracruz, Mexico represents the northernmost Neotropical lowland rainforest and has lost 84 % of its forests in the last forty years. Rich terrestrial and aquatic species communities are found throughout Neotropical forests, habitats increasingly threatened by land management practices. Plant-held waters, phytotelmata, are ecologically important discrete microhabitats harboring many specialist invertebrates and are abundant in tropical forests. In this study, using artificial tree holes, we examined invertebrate tree hole communities in a mature forest of Los Tuxtlas and in a managed habitat adjacent to the Los Tuxtlas Biological Station. Based on the proximity of human and livestock communities to managed habitats and the dispersal limitations of some phytotelmata specialists, we expected to find community composition differences between the two habitats. We found distinct differences in chironomid colonization; Tanypodinae, a predaceous subfamily, was present in the managed habitat and its omnivorous counterpart, Chironominae, was present in the forest. We found differences in mosquito colonization with more predaceous Toxorhychites in the managed habitat. Haemagogus mosquitoes were only present in the managed habitat. These results indicate different colonization ability across phytotelmata specialists and warn of larger community shifts and potential public health hazards with continued and intensified forest fragmentation and degradation.","[Khazan, Emily S.; Bright, Eric G.; Beyer, Jessica E.] Univ Oklahoma, Dept Biol, Norman, OK 73019 USA; [Khazan, Emily S.] Cano Palma Biol Stn, Pococi, Limon, Costa Rica; [Bright, Eric G.] Oklahoma Biol Survey, Norman, OK 73019 USA","Khazan, ES (corresponding author), Univ Oklahoma, Dept Biol, 730 Van Vleet Oval,Room 314, Norman, OK 73019 USA.",ekhazan@gmail.com,,"Beyer, Jessica/0000-0002-3388-3255",OU Department of Biology; OU College of Arts and Sciences,"Thanks to R. Coates, A. Bundy, J. Bujan, T. Hallidayschult, ZEEB Journal Club, M. Patten, J. Munoz, A. Geheber. Funding provided by OU Department of Biology and OU College of Arts and Sciences.",,73,3,4,2,22,SPRINGER,DORDRECHT,"VAN GODEWIJCKSTRAAT 30, 3311 GZ DORDRECHT, NETHERLANDS",1366-638X,1572-9753,,J INSECT CONSERV,J. Insect Conserv.,AUG,2015,19,4,,,,,681,690,,10.1007/s10841-015-9791-4,,,10,Biodiversity Conservation; Entomology,Biodiversity & Conservation; Entomology,CQ8IF,WOS:000360850000008,,,,,2020-12-20,
