J,"Thomas, CJ; Cross, DE; Bogh, C",,,,"Thomas, Christopher J.; Cross, Donall E.; Bogh, Claus",,,Landscape Movements of Anopheles gambiae Malaria Vector Mosquitoes in Rural Gambia,PLOS ONE,,,English,Article,,,,,,,SPATIAL-DISTRIBUTION; CULICIDAE DISPERSAL; BREEDING SITES; AEDES-AEGYPTI; WEST-AFRICA; DIPTERA; TRANSMISSION; FUNESTUS; SURVIVAL; LONG,"Background: For malaria control in Africa it is crucial to characterise the dispersal of its most efficient vector, Anopheles gambiae, in order to target interventions and assess their impact spatially. Our study is, we believe, the first to present a statistical model of dispersal probability against distance from breeding habitat to human settlements for this important disease vector. Methods/Principal Findings: We undertook post-hoc analyses of mosquito catches made in The Gambia to derive statistical dispersal functions for An. gambiae sensu lato collected in 48 villages at varying distances to alluvial larval habitat along the River Gambia. The proportion dispersing declined exponentially with distance, and we estimated that 90% of movements were within 1.7 km. Although a 'heavy-tailed' distribution is considered biologically more plausible due to active dispersal by mosquitoes seeking blood meals, there was no statistical basis for choosing it over a negative exponential distribution. Using a simple random walk model with daily survival and movements previously recorded in Burkina Faso, we were able to reproduce the dispersal probabilities observed in The Gambia. Conclusions/Significance: Our results provide an important quantification of the probability of An. gambiae s.l. dispersal in a rural African setting typical of many parts of the continent. However, dispersal will be landscape specific and in order to generalise to other spatial configurations of habitat and hosts it will be necessary to produce tractable models of mosquito movements for operational use. We show that simple random walk models have potential. Consequently, there is a pressing need for new empirical studies of An. gambiae survival and movements in different settings to drive this development.","[Thomas, Christopher J.; Cross, Donall E.] Aberystwyth Univ, Inst Biol Environm & Rural Sci, Aberystwyth, Dyfed, Wales; [Bogh, Claus] Sumba Fdn, Kuta Poleng, Bali, Indonesia","Thomas, CJ (corresponding author), Aberystwyth Univ, Inst Biol Environm & Rural Sci, Aberystwyth, Dyfed, Wales.",cjt@aber.ac.uk,,,Natural Environment Research CouncilNERC Natural Environment Research Council [NE/H022740/1],"This work was funded by Natural Environment Research Council grant NE/H022740/1 (http://www.nerc.ac.uk) and the original study by DANIDA. The funders had no role in study design, data collection and analysis, decision to publish, or preparation of the manuscript.",,62,26,26,0,18,PUBLIC LIBRARY SCIENCE,SAN FRANCISCO,"1160 BATTERY STREET, STE 100, SAN FRANCISCO, CA 94111 USA",1932-6203,,,PLOS ONE,PLoS One,JUL 18,2013,8,7,,,,,,,e68679,10.1371/journal.pone.0068679,,,7,Multidisciplinary Sciences,Science & Technology - Other Topics,214PM,WOS:000324146200025,23874719,"DOAJ Gold, Green Published, Green Accepted",,,2020-12-20,
J,"Moiroux, N; Bio-Bangana, AS; Djenontin, A; Chandre, F; Corbel, V; Guis, H",,,,"Moiroux, Nicolas; Bio-Bangana, Abdul S.; Djenontin, Armel; Chandre, Fabrice; Corbel, Vincent; Guis, Helene",,,"Modelling the risk of being bitten by malaria vectors in a vector control area in southern Benin, west Africa",PARASITES & VECTORS,,,English,Article,,,,,,Malaria; Anopheles; Remote sensing; Modelling; Host-vector contact,MULTIPLE INSECTICIDE RESISTANCE; ANOPHELES-FUNESTUS DIPTERA; LARVAL SOURCE MANAGEMENT; GAMBIAE MOLECULAR-FORMS; CONTROL INTERVENTIONS; AQUATIC STAGES; TREATED NETS; CULICIDAE; TEMPERATURE; MOSQUITOS,"Background: The diversity of malaria vector populations, expressing various resistance and/or behavioural patterns could explain the reduced effectiveness of vector control interventions reported in some African countries. A better understanding of the ecology and distribution of malaria vectors is essential to design more effective and sustainable strategies for malaria control and elimination. Here, we analyzed the spatio-temporal risk of the contact between humans and the sympatric An. funestus and both M and S molecular forms of An. gambiae s.s. in an area of Benin with high coverage of vector control measures with an unprecedented level of resolution. Methods: Presence-absence data for the three vectors from 1-year human-landing collections in 19 villages were assessed using binomial mixed-effects models according to vector control measures and environmental covariates derived from field and remote sensing data. After 8-fold cross-validations of the models, predictive maps of the risk of the contact between humans and the sympatric An. funestus and both molecular M and S forms of An. gambiae s.s. were computed. Results: Model validations showed that the An. funestus, An. gambiae M form, and S form models provided an excellent (Area Under Curve>0.9), a good (AUC>0.8), and an acceptable (AUC>0.7) level of prediction, respectively. The distribution area of the probability of contact between human and An. funestus largely overlaps that of An. gambiae M form but this latter showed important seasonal variation. An. gambiae S form also showed seasonal variation but with different ecological preferences. Landscape data were useful to discriminate between the species' distributions. Conclusions: These results showed that available remote sensing data could help in predicting the human-vector contact for several species of malaria vectors at a village level scale. The predictive maps showed seasonal and spatial variations in the risk of human-vector contact for all three vectors. Such maps could help Malaria Control Programmes to implement more effective vector control strategy by taking into account to the dynamics of malaria vector species.","[Moiroux, Nicolas; Chandre, Fabrice; Corbel, Vincent] IRD, MIVEGEC IRD CNRS 5290 UM1 UM2 224, F-34394 Montpellier, France; [Djenontin, Armel] IRD, MIVEGEC IRD CNRS 5290 UM1 UM2 224, Cotonou, Benin; [Bio-Bangana, Abdul S.; Djenontin, Armel] Minist Sante, CREC, Cotonou, Benin; [Corbel, Vincent] Kasetsart Univ, Fac Agr, Dept Entomol, Bangkok 10900, Thailand; [Guis, Helene] CIRAD, UMR CMAEE, F-34398 Montpellier, France; [Guis, Helene] INRA, UMR CMAEE 1309, F-34398 Montpellier, France","Moiroux, N (corresponding author), IRD, MIVEGEC IRD CNRS 5290 UM1 UM2 224, BP64501, F-34394 Montpellier, France.",nicolas.moiroux@ird.fr,"Corbel, VIncent/G-9576-2016; Chandre, Fabrice/Q-3429-2019","Chandre, Fabrice/0000-0002-1994-9705; Moiroux, Nicolas/0000-0001-6755-6167",French ministry of foreign affairs through the SCAC programme; IRD; EUEuropean Union (EU) [FP7-261504 EDENext],"We thank populations of the villages for their kind support and collaboration. We also thank all the field and laboratory staff for their strong commitment to this project. We thank the French ministry of foreign affairs through the SCAC programme, IRD, and Mr Francois Lacoste for their financial support. This study was partially funded by EU grant FP7-261504 EDENext and is catalogued by the EDENext Steering Committee as EDENext104 (http://www.edenext.eu). The contents of this publication are the sole responsibility of the authors and don't necessarily reflect the views of the European Commission. We thank the ISIS programme of CNES for providing us the SPOT image.",,67,5,5,0,14,BMC,LONDON,"CAMPUS, 4 CRINAN ST, LONDON N1 9XW, ENGLAND",1756-3305,,,PARASITE VECTOR,Parasites Vectors,MAR 15,2013,6,,,,,,,,71,10.1186/1756-3305-6-71,,,13,Parasitology; Tropical Medicine,Parasitology; Tropical Medicine,114TS,WOS:000316766100001,23497700,"DOAJ Gold, Green Published",,,2020-12-20,
J,"Coulibaly, D; Rebaudet, S; Travassos, M; Tolo, Y; Laurens, M; Kone, AK; Traore, K; Guindo, A; Diarra, I; Niangaly, A; Daou, M; Dembele, A; Sissoko, M; Kouriba, B; Dessay, N; Gaudart, J; Piarroux, R; Thera, MA; Plowe, CV; Doumbo, OK",,,,"Coulibaly, Drissa; Rebaudet, Stanislas; Travassos, Mark; Tolo, Youssouf; Laurens, Matthew; Kone, Abdoulaye K.; Traore, Karim; Guindo, Ando; Diarra, Issa; Niangaly, Amadou; Daou, Modibo; Dembele, Ahmadou; Sissoko, Mody; Kouriba, Bourema; Dessay, Nadine; Gaudart, Jean; Piarroux, Renaud; Thera, Mahamadou A.; Plowe, Christopher V.; Doumbo, Ogobara K.",,,"Spatio-temporal analysis of malaria within a transmission season in Bandiagara, Mali",MALARIA JOURNAL,,,English,Article,,,,,,Malaria; Geographic information system; Malaria transmission heterogeneity,RISK-FACTORS; FALCIPARUM-MALARIA; CHILDHOOD MALARIA; KILIFI DISTRICT; EPIDEMIOLOGY; POPULATION; CHILDREN; CLUSTERS; DENSITY; SYSTEM,"Background: Heterogeneous patterns of malaria transmission are thought to be driven by factors including host genetics, distance to mosquito breeding sites, housing construction, and socio-behavioural characteristics. Evaluation of local transmission epidemiology to characterize malaria risk is essential for planning malaria control and elimination programmes. The use of geographical information systems (GIS) techniques has been a major asset to this approach. To assess time and space distribution of malaria disease in Bandiagara, Mali, within a transmission season, data were used from an ongoing malaria incidence study that enrolled 300 participants aged under six years old. Methods: Children's households were georeferenced using a handheld global position system. Clinical malaria was defined as a positive blood slide for Plasmodium falciparum asexual stages associated with at least one of the following signs: headache, body aches, fever, chills and weakness. Daily rainfall was measured at the local weather station. Landscape features of Bandiagara were obtained from satellite images and field survey. QGIS (TM) software was used to map malaria cases, affected and non-affected children, and the number of malaria episodes per child in each block of Bandiagara. Clusters of high or low risk were identified under SaTScan (R) software according to a Bernoulli model. Results: From June 2009 to May 2010, 296 clinical malaria cases were recorded. Though clearly temporally related to the rains, Plasmodium falciparum occurrence persisted late in the dry season. Two hot spots of malaria transmission also found, notably along the Yame River, characterized by higher than expected numbers of malaria cases, and high numbers of clinical episodes per child. Conversely, the north-eastern sector of the town had fewer cases despite its proximity to a large body of standing water which was mosquito habitat. Conclusion: These results confirm the existence of a marked spatial heterogeneity of malaria transmission in Bandiagara, providing support for implementation of targeted interventions.","[Coulibaly, Drissa; Tolo, Youssouf; Kone, Abdoulaye K.; Traore, Karim; Guindo, Ando; Diarra, Issa; Niangaly, Amadou; Daou, Modibo; Dembele, Ahmadou; Sissoko, Mody; Kouriba, Bourema; Thera, Mahamadou A.; Doumbo, Ogobara K.] Univ Sci Tech & Technol Bamako, Fac Med & Dent, Dept Epidemiol Parasit Dis, Bamako, Mali; [Travassos, Mark; Laurens, Matthew; Plowe, Christopher V.] Univ Maryland, Sch Med, Ctr Vaccine Dev, Howard Hughes Med Inst, Baltimore, MD 21201 USA; [Rebaudet, Stanislas; Gaudart, Jean; Piarroux, Renaud] Aix Marseille Univ, Marseille, France; [Dessay, Nadine] Inst Rech Dev, Montpellier, France","Coulibaly, D (corresponding author), Univ Sci Tech & Technol Bamako, Fac Med & Dent, Dept Epidemiol Parasit Dis, BP 1805,Point G, Bamako, Mali.",coulibalyd@icermali.org,"Laurens, Matthew/E-7293-2013; gaudart, jean/D-9071-2013; Dessay, Nadine/Y-1791-2019; Dessay, Nadine/J-9856-2016","Laurens, Matthew/0000-0003-3874-581X; gaudart, jean/0000-0001-9006-5729; Dessay, Nadine/0000-0003-0526-3531; Dessay, Nadine/0000-0003-0526-3531; Thera, Mahamadou A/0000-0002-2679-035X; piarroux, renaud/0000-0002-4151-4134","National Institute of Allergy and Infectious DiseasesUnited States Department of Health & Human ServicesNational Institutes of Health (NIH) - USANIH National Institute of Allergy & Infectious Diseases (NIAID) [5U01AI065683]; Fogarty International Center, National Institutes of HealthUnited States Department of Health & Human ServicesNational Institutes of Health (NIH) - USANIH Fogarty International Center (FIC) [D43TW001589]; FOGARTY INTERNATIONAL CENTERUnited States Department of Health & Human ServicesNational Institutes of Health (NIH) - USANIH Fogarty International Center (FIC) [D43TW001589, D43TW001589, D43TW001589, D43TW001589, D43TW001589, D43TW001589, D43TW001589, D43TW001589, D43TW001589, D43TW001589, D43TW001589, D43TW001589, D43TW001589, D43TW001589, D43TW001589, D43TW001589, D43TW001589, D43TW001589, D43TW001589] Funding Source: NIH RePORTER; NATIONAL INSTITUTE OF ALLERGY AND INFECTIOUS DISEASESUnited States Department of Health & Human ServicesNational Institutes of Health (NIH) - USANIH National Institute of Allergy & Infectious Diseases (NIAID) [U01AI065683, U01AI065683, U01AI065683, U01AI065683, U01AI065683] Funding Source: NIH RePORTER","The Malaria Incidence Study was supported by cooperative agreement 5U01AI065683 from the National Institute of Allergy and Infectious Diseases; The GIS study was supported by the AMMA consortium and the grant D43TW001589 from the Fogarty International Center, National Institutes of Health.",,42,24,26,0,44,BMC,LONDON,"CAMPUS, 4 CRINAN ST, LONDON N1 9XW, ENGLAND",1475-2875,,,MALARIA J,Malar. J.,MAR 1,2013,12,,,,,,,,82,10.1186/1475-2875-12-82,,,9,Infectious Diseases; Parasitology; Tropical Medicine,Infectious Diseases; Parasitology; Tropical Medicine,121FT,WOS:000317229000001,23452561,"DOAJ Gold, Green Published",,,2020-12-20,
J,"Burkett-Cadena, ND; McClure, CJW; Estep, LK; Eubanks, MD",,,,"Burkett-Cadena, Nathan D.; McClure, Christopher J. W.; Estep, Laura K.; Eubanks, Micky D.",,,Hosts or habitats: What drives the spatial distribution of mosquitoes?,ECOSPHERE,,,English,Article,,,,,,Culex; ectotherm; GIS; mosquito-borne disease; spatial epidemiology; vector ecology,EQUINE ENCEPHALOMYELITIS VIRUS; CULEX-TARSALIS DIPTERA; UPSTATE NEW-YORK; COACHELLA VALLEY; MODEL SELECTION; WEST-NILE; VECTOR; CULICIDAE; PATTERNS; RISK,"Understanding the factors that influence the distribution of vectors is critical to assess the risk of disease transmission across landscapes. For mosquitoes, existing spatial models use only habitat elements (hydrologic and floristic) to predict the distribution of disease vectors within the landscape, ignoring the potential importance of the distribution of hosts. We tested the hypothesis that the distribution of hosts would better explain the spatial distribution of mosquitoes than habitat variables using Information Theory and Poisson Regression. We analyzed the abundance of ectotherm-biting mosquitoes and their hosts from 37 points over a 28-km(2) area in Tuskegee National Forest, Alabama, USA. We compared models built using information regarding habitat, hosts, or both for their ability to explain the abundance of Culex peccator and Culex territans, two mosquito species that specialize on reptiles and amphibians. Models built using both host and habitat information were the best models for both species, suggesting that information regarding the distribution of mosquito hosts greatly improves models of mosquito distributions. Moreover, when differences in habitat makeup among stations were accounted for, mosquitoes were found to be significantly more abundant at locations with greater host abundance. Since most mosquitoes feed on only a limited range of hosts and successful blood feeding is one of the most crucial bottlenecks in the life cycle of mosquitoes, it follows that mosquitoes would aggregate in areas of greatest host density. Habitat influences the availability of suitable larval development sites, and to some extent, distribution of hosts. Our analysis, however, shows that within the landscape the distribution of host animals is a crucial factor in determining the spatial distribution of vectors. This has clear and important implications for determining which areas are at a greater risk for zoonotic arboviruses and is a potentially transformative paradigm for understanding the factors that influence the spatial distribution of disease vectors.","[Burkett-Cadena, Nathan D.; Eubanks, Micky D.] Auburn Univ, Dept Entomol & Plant Pathol, Auburn, AL 36849 USA; [McClure, Christopher J. W.; Estep, Laura K.] Auburn Univ, Dept Biol Sci, Auburn, AL 36849 USA","Burkett-Cadena, ND (corresponding author), Univ S Florida, Dept Global Hlth, Tampa, FL 33606 USA.",nburkett@health.usf.edu,"McClure, Christopher/J-2712-2019","McClure, Christopher/0000-0003-1216-7425; Burkett-Cadena, Nathan/0000-0001-6168-1637",National Institute of Allergy and Infectious DiseasesUnited States Department of Health & Human ServicesNational Institutes of Health (NIH) - USANIH National Institute of Allergy & Infectious Diseases (NIAID) [R01AI049724],Thanks to Katherine Gray and Nathan Click for assistance in the field. Jorge Hersel (TNF Ranger) facilitated permits for working on National Forest lands. Dr. David Bayne permitted access to private lands adjacent to Tuskegee National Forest. Sean Graham contributed helpful suggestions to an early manuscript draft. This work was supported by project # R01AI049724 from the National Institute of Allergy and Infectious Diseases.,,50,29,29,1,42,WILEY,HOBOKEN,"111 RIVER ST, HOBOKEN 07030-5774, NJ USA",2150-8925,,,ECOSPHERE,Ecosphere,FEB,2013,4,2,,,,,,,30,10.1890/ES13-00009.1,,,16,Ecology,Environmental Sciences & Ecology,256JN,WOS:000327306400014,,DOAJ Gold,,,2020-12-20,
J,"Coffey, LL; Forrester, N; Tsetsarkin, K; Vasilakis, N; Weaver, SC",,,,"Coffey, Lark L.; Forrester, Naomi; Tsetsarkin, Konstantin; Vasilakis, Nikos; Weaver, Scott C.",,,Factors shaping the adaptive landscape for arboviruses: implications for the emergence of disease,FUTURE MICROBIOLOGY,,,English,Review,,,,,,adaptation; alphavirus; emergence; evolution; fitness; flavivirus; mosquito; vector,WEST-NILE-VIRUS; EQUINE ENCEPHALITIS-VIRUS; SYLVATIC DENGUE VIRUS; CHIKUNGUNYA VIRUS; GENETIC DIVERSITY; HOST ALTERNATION; MUTANT SPECTRUM; MOSQUITO BITE; RNA VIRUSES; IN-VIVO,"Many examples of the emergence or re-emergence of infectious diseases involve the adaptation of zoonotic viruses to new amplification hosts or to humans themselves. These include several instances of simple mutational adaptations, often to hosts closely related to the natural reservoirs. However, based on theoretical grounds, arthropod-borne viruses, or arboviruses, may face several challenges for adaptation to new hosts. Here, we review recent findings regarding adaptive evolution of arboviruses and its impact on disease emergence. We focus on the zoonotic alphaviruses Venezuelan equine encephalitis and chikungunya viruses, which have undergone adaptive evolution that mediated recent outbreaks of disease, as well as the flaviviruses dengue and West Nile viruses, which have emerged via less dramatic adaptive mechanisms.","[Coffey, Lark L.] Univ Calif San Francisco, Dept Lab Med, Blood Syst Res Inst, San Francisco, CA 94118 USA; [Forrester, Naomi; Tsetsarkin, Konstantin; Vasilakis, Nikos; Weaver, Scott C.] Univ Texas Med Branch, Inst Human Infect & Immun, Ctr Biodef & Emerging Infect Dis, Galveston, TX 77555 USA; [Forrester, Naomi; Tsetsarkin, Konstantin; Vasilakis, Nikos; Weaver, Scott C.] Univ Texas Med Branch, Dept Pathol, Galveston, TX 77555 USA","Weaver, SC (corresponding author), Univ Texas Med Branch, Inst Human Infect & Immun, Ctr Biodef & Emerging Infect Dis, Galveston, TX 77555 USA.",sweaver@utmb.edu,"Weaver, Scott C/D-6490-2011; Vasilakis, Nikos/ABE-7318-2020","Weaver, Scott C/0000-0001-8016-8556; ","NIHUnited States Department of Health & Human ServicesNational Institutes of Health (NIH) - USA [R01-AI071192, R01-AI069145, R01-AI48807]; NATIONAL INSTITUTE OF ALLERGY AND INFECTIOUS DISEASESUnited States Department of Health & Human ServicesNational Institutes of Health (NIH) - USANIH National Institute of Allergy & Infectious Diseases (NIAID) [R01AI069145, R01AI071192, R01AI048807, R01AI048807, R01AI069145, R01AI048807, R01AI048807, R01AI071192, R01AI071192, R01AI048807, R01AI069145, R01AI048807, R01AI069145, R01AI071192, R01AI071192, R01AI071192] Funding Source: NIH RePORTER","The research described was supported by NIH grants R01-AI071192, R01-AI069145 and R01-AI48807. The authors have no other relevant affiliations or financial involvement with any organization or entity with a financial interest in or financial conflict with the subject matter or materials discussed in the manuscript apart from those disclosed.",,113,88,89,1,47,FUTURE MEDICINE LTD,LONDON,"UNITEC HOUSE, 3RD FLOOR, 2 ALBERT PLACE, FINCHLEY CENTRAL, LONDON, N3 1QB, ENGLAND",1746-0913,1746-0921,,FUTURE MICROBIOL,Future Microbiol.,FEB,2013,8,2,,,,,155,176,,10.2217/FMB.12.139,,,22,Microbiology,Microbiology,084ZH,WOS:000314579800008,23374123,Green Accepted,,,2020-12-20,
J,"Crowder, DW; Dykstra, EA; Brauner, JM; Duffy, A; Reed, C; Martin, E; Peterson, W; Carriere, Y; Dutilleul, P; Owen, JP",,,,"Crowder, David W.; Dykstra, Elizabeth A.; Brauner, Jo Marie; Duffy, Anne; Reed, Caitlin; Martin, Emily; Peterson, Wade; Carriere, Yves; Dutilleul, Pierre; Owen, Jeb P.",,,West Nile Virus Prevalence across Landscapes Is Mediated by Local Effects of Agriculture on Vector and Host Communities,PLOS ONE,,,English,Article,,,,,,,CULEX-TARSALIS DIPTERA; COREGIONALIZATION ANALYSIS; MULTISCALE ASSESSMENT; SPATIAL RELATIONSHIPS; LARGE-SCALE; CULICIDAE; RISK; EPIDEMIOLOGY; DIVERSITY; OUTBREAKS,"Arthropod-borne viruses (arboviruses) threaten the health of humans, livestock, and wildlife. West Nile virus (WNV), the world's most widespread arbovirus, invaded the United States in 1999 and rapidly spread across the county. Although the ecology of vectors and hosts are key determinants of WNV prevalence across landscapes, the factors shaping local vector and host populations remain unclear. Here, we used spatially-explicit models to evaluate how three land-use types (orchards, vegetable/forage crops, natural) and two climatic variables (temperature, precipitation) influence the prevalence of WNV infections and vector/host distributions at landscape and local spatial scales. Across landscapes, we show that orchard habitats were associated with greater prevalence of WNV infections in reservoirs (birds) and incidental hosts (horses), while increased precipitation was associated with fewer infections. At local scales, orchard habitats increased the prevalence of WNV infections in vectors (mosquitoes) and the abundance of mosquitoes and two key reservoir species, the American robin and the house sparrow. Thus, orchard habitats benefitted WNV vectors and reservoir hosts locally, creating focal points for the transmission of WNV at landscape scales in the presence of suitable climatic conditions.","[Crowder, David W.; Martin, Emily; Peterson, Wade; Owen, Jeb P.] Washington State Univ, Dept Entomol, Pullman, WA 99164 USA; [Dykstra, Elizabeth A.; Brauner, Jo Marie; Duffy, Anne; Reed, Caitlin] Washington State Dept Hlth, Olympia, WA USA; [Carriere, Yves] Univ Arizona, Dept Entomol, Tucson, AZ 85721 USA; [Dutilleul, Pierre] McGill Univ, Dept Plant Sci, Ste Anne De Bellevue, PQ, Canada","Crowder, DW (corresponding author), Washington State Univ, Dept Entomol, Pullman, WA 99164 USA.",dcrowder@wsu.edu,,"Owen, Jeb/0000-0002-2042-0526; Scott, Emily/0000-0001-9295-9320",United States Department of Agriculture (USDA) Agriculture and Food Research Initiative [2011-67012-30718]; USDA Risk Avoidance and Mitigation Program [2006-0207436],"This study was supported by United States Department of Agriculture (USDA) Agriculture and Food Research Initiative Project 2011-67012-30718 and USDA Risk Avoidance and Mitigation Program Project 2006-0207436. The funders had no role in study design, data collection and analysis, decision to publish, or preparation of the manuscript.; We thank the Benton, Yakima, Franklin, Columbia and Grant #1 Mosquito Control Districts, and the Kittitas County Local Health Department, for sharing their mosquito surveillance data. * Disclaimer. The contents of this manuscript are solely the responsibility of the authors and do not necessarily represent the official views or policies of the Washington State Department of Health.",,44,28,29,1,62,PUBLIC LIBRARY SCIENCE,SAN FRANCISCO,"1160 BATTERY STREET, STE 100, SAN FRANCISCO, CA 94111 USA",1932-6203,,,PLOS ONE,PLoS One,JAN 30,2013,8,1,,,,,,,e55006,10.1371/journal.pone.0055006,,,8,Multidisciplinary Sciences,Science & Technology - Other Topics,098QM,WOS:000315563800102,23383032,"DOAJ Gold, Green Published",,,2020-12-20,
