Publication Type,Authors,Book Authors,Book Editors,Book Group Authors,Author Full Names,Book Author Full Names,Group Authors,Article Title,Source Title,Book Series Title,Book Series Subtitle,Language,Document Type,Conference Title,Conference Date,Conference Location,Conference Sponsor,Conference Host,Author Keywords,Keywords Plus,Abstract,Addresses,Reprint Addresses,Email Addresses,Researcher Ids,ORCIDs,Funding Orgs,Funding Text,Cited References,Cited Reference Count,"Times Cited, WoS Core","Times Cited, All Databases",180 Day Usage Count,Since 2013 Usage Count,Publisher,Publisher City,Publisher Address,ISSN,eISSN,ISBN,Journal Abbreviation,Journal ISO Abbreviation,Publication Date,Publication Year,Volume,Issue,Part Number,Supplement,Special Issue,Meeting Abstract,Start Page,End Page,Article Number,DOI,Book DOI,Early Access Date,Number of Pages,WoS Categories,Research Areas,IDS Number,UT (Unique WOS ID),Pubmed Id,Open Access Designations,Highly Cited Status,Hot Paper Status,Date of Export,
J,"Clark, NJ; Drovetski, SV; Voelker, G",,,,"Clark, Nicholas J.; Drovetski, Sergei, V; Voelker, Gary",,,Robust geographical determinants of infection prevalence and a contrasting latitudinal diversity gradient for haemosporidian parasites in Western Palearctic birds,MOLECULAR ECOLOGY,,,English,Article,,,,,,climate change; Haemoproteus; infection probability; Leucocytozoon; normalized difference vegetation index; Plasmodium,CLIMATE-CHANGE; AVIAN MALARIA; HAEMOPROTEUS HAEMOSPORIDA; SPATIAL-DISTRIBUTION; MOSQUITO ABUNDANCE; GLOBAL DIVERSITY; TEMPERATURE; COMMUNITIES; CULICOIDES; ECOLOGY,"Identifying robust environmental predictors of infection probability is central to forecasting and mitigating the ongoing impacts of climate change on vector-borne disease threats. We applied phylogenetic hierarchical models to a data set of 2,171 Western Palearctic individual birds from 47 species to determine how climate and landscape variation influence infection probability for three genera of haemosporidian blood parasites (Haemoproteus,Leucocytozoon, andPlasmodium). Our comparative models found compelling evidence that birds in areas with higher vegetation density (captured by the normalized difference vegetation index [NDVI]) had higher likelihoods of carrying parasite infection. Magnitudes of this relationship were remarkably similar across parasite genera considering that these parasites use different arthropod vectors and are widely presumed to be epidemiologically distinct. However, we also uncovered key differences among genera that highlighted complexities in their climate responses. In particular, prevalences ofHaemoproteusandPlasmodiumshowed strong but contrasting relationships with winter temperatures, supporting mounting evidence that winter warming is a key environmental filter impacting the dynamics of host-parasite interactions. Parasite phylogenetic community diversities demonstrated a clear but contrasting latitudinal gradient, withHaemoproteusdiversity increasing towards the equator andLeucocytozoondiversity increasing towards the poles.Haemoproteusdiversity also increased in regions with higher vegetation density, supporting our evidence that summer vegetation density is important for structuring the distributions of these parasites. Ongoing variation in winter temperatures and vegetation characteristics will probably have far-reaching consequences for the transmission and spread of vector-borne diseases.","[Clark, Nicholas J.] Univ Queensland, Sch Vet Sci, UQ Spatial Epidemiol Lab, Gatton, Qld, Australia; [Drovetski, Sergei, V] US Geol Survey, Patuxent Wildlife Res Ctr, Beltsville, MD USA; [Voelker, Gary] Texas A&M Univ, Dept Ecol & Conservat Biol, College Stn, TX USA","Clark, NJ (corresponding author), Univ Queensland, Sch Vet Sci, UQ Spatial Epidemiol Lab, Gatton, Qld, Australia.",nicholas.j.clark@gmail.com,,"Drovetski, Serguei/0000-0002-1832-5597","National Geographic SocietyNational Geographic Society; COMPETE programme; Fundaca o para a Ciencia e a Tecnologia/MEC [FCOMP-01-0124-FEDER-008941, PTDC/BIA-BEC/103435/2008]","National Geographic Society; COMPETE programme, Grant/Award Number: POPH/QREN/FSE; Fundaca o para a Ciencia e a Tecnologia/MEC, Grant/Award Number: FCOMP-01-0124-FEDER-008941 and PTDC/BIA-BEC/103435/2008",,83,0,0,8,8,WILEY,HOBOKEN,"111 RIVER ST, HOBOKEN 07030-5774, NJ USA",0962-1083,1365-294X,,MOL ECOL,Mol. Ecol.,AUG,2020,29,16,,,,,3131,3143,,10.1111/mec.15545,,AUG 2020,13,Biochemistry & Molecular Biology; Ecology; Evolutionary Biology,Biochemistry & Molecular Biology; Environmental Sciences & Ecology; Evolutionary Biology,NK2AO,WOS:000559493600001,32652721,,,,2020-12-20,
J,"Gupta, A; Katarya, R",,,,"Gupta, Aakansha; Katarya, Rahul",,,Social media based surveillance systems for healthcare using machine learning: A systematic review,JOURNAL OF BIOMEDICAL INFORMATICS,,,English,Review,,,,,,Health informatics; Machine learning; Outbreak detection; Surveillance systems; Social media,MOSQUITO-BORNE DISEASES; EBOLA-VIRUS DISEASE; ARTIFICIAL-INTELLIGENCE; SYNDROMIC SURVEILLANCE; ZIKA VIRUS; TWITTER; INFORMATION; INTERNET; ENGAGEMENT; EPIDEMIC,"Background: Real-time surveillance in the field of health informatics has emerged as a growing domain of interest among worldwide researchers. Evolution in this field has helped in the introduction of various initiatives related to public health informatics. Surveillance systems in the area of health informatics utilizing social media information have been developed for early prediction of disease outbreaks and to monitor diseases. In the past few years, the availability of social media data, particularly Twitter data, enabled real-time syndromic surveillance that provides immediate analysis and instant feedback to those who are charged with follow-ups and investigation of potential outbreaks. In this paper, we review the recent work, trends, and machine learning(ML) text classification approaches used by surveillance systems seeking social media data in the healthcare domain. We also highlight the limitations and challenges followed by possible future directions that can be taken further in this domain. Methods: To study the landscape of research in health informatics performing surveillance of the various health-related data posted on social media or web-based platforms, we present a bibliometric analysis of the 1240 publications indexed in multiple scientific databases (IEEE, ACM Digital Library, ScienceDirect, PubMed) from the year 2010-2018. The papers were further reviewed based on the various machine learning algorithms used for analyzing health-related text posted on social media platforms. Findings:: Based on the corpus of 148 selected articles, the study finds the types of social media or web-based platforms used for surveillance in the healthcare domain, along with the health topic(s) studied by them. In the corpus of selected articles, we found 26 articles were using machine learning technique. These articles were studied to find commonly used ML techniques. The majority of studies (24%) focused on the surveillance of flu or influenza-like illness (ILI). Twitter (64%) is the most popular data source to perform surveillance research using social media text data, and Support Vector Machine (SVM) (33%) being the most used ML algorithm for text classification. Conclusions: The inclusion of online data in surveillance systems has improved the disease prediction ability over traditional syndromic surveillance systems. However, social media based surveillance systems have many limitations and challenges, including noise, demographic bias, privacy issues, etc. Our paper mentions future directions, which can be useful for researchers working in the area. Researchers can use this paper as a library for social media based surveillance systems in the healthcare domain and can expand such systems by incorporating the future works discussed in our paper.","[Gupta, Aakansha; Katarya, Rahul] Delhi Technol Univ, Dept Comp Sci & Engn, Delhi 110042, India","Katarya, R (corresponding author), Delhi Technol Univ, Dept Comp Sci & Engn, Delhi 110042, India.",,,"Katarya, Dr. Rahul/0000-0001-7763-291X; Gupta, Aakansha/0000-0001-7100-0014",,,,133,1,1,11,11,ACADEMIC PRESS INC ELSEVIER SCIENCE,SAN DIEGO,"525 B ST, STE 1900, SAN DIEGO, CA 92101-4495 USA",1532-0464,1532-0480,,J BIOMED INFORM,J. Biomed. Inform.,AUG,2020,108,,,,,,,,103500,10.1016/j.jbi.2020.103500,,,13,"Computer Science, Interdisciplinary Applications; Medical Informatics",Computer Science; Medical Informatics,NH3SY,WOS:000564594600007,32622833,Green Published,,,2020-12-20,
J,"Verhulst, NO; Brendle, A; Blanckenhorn, WU; Mathis, A",,,,"Verhulst, Niels O.; Brendle, Alexsandra; Blanckenhorn, Wolf U.; Mathis, Alexander",,,Thermal preferences of subtropical Aedes aegypti and temperate Ae. japonicus mosquitoes,JOURNAL OF THERMAL BIOLOGY,,,English,Article,,,,,,Behaviour; Culicidae; Humidity; Microclimate; Temperature preference; Vector,TRANSMISSION; HUMIDITY; DIPTERA; CLIMATE,"Temperature is an important determinant affecting the capacity of disease vectors like mosquitoes (Culicidae) to transmit disease agents. Although the impact of temperature on vector-borne disease dynamics has been studied intensively, the actual temperature encountered by the vector in a heterogeneous landscape is rarely taken into account. If disease vectors have temperature preferences and therefore select specific microhabitats, this would substantially influence key life history traits that determine transmission intensity. The thermal preferences of subtropical Aedes aegypti and temperate Ae. japonicus mosquitoes were investigated in a temperature gradient setup consisting of a Plexiglas box on top of an aluminium plate on two thermal regulators. Blood-fed (one day after feeding) and unfed (non-blood-fed) mosquitoes were released in small (15-20 degrees C, 20-25 degrees C, 25-30 degrees C) and large (15-30 degrees C, 30-45 degrees C) temperature gradients to assess their thermal preferences after 15 min. Additionally, the effect of humidity was investigated in a two-choice chamber setup. Both mosquito species avoided higher temperatures, pronouncedly dangerously high temperatures in the 30-45 degrees C gradient. At lower temperatures, blood-fed mosquitoes preferred the cooler sides of the 20-25 degrees C and 25-30 degrees C gradient, which were all below their rearing temperature. In the lowest gradient of 15-20 degrees C, no preferences were found. The thermal preference of unfed mosquitoes was similar to that of the blood-fed mosquitoes. No humidity preference or effect of humidity on temperature preferences was observed within the tested range (40-90%). The set-up allows for assessing the thermal preference of mosquitoes under controlled conditions. The observed preference of mosquitoes for cooler temperatures would increase their longevity and slow down pathogen development. If similar micmhabitat selection is observed in the field, vector borne disease models should be adjusted accordingly.","[Verhulst, Niels O.; Brendle, Alexsandra; Mathis, Alexander] Univ Zurich, Vetsuisse Fac, Natl Ctr Vector Entomol, Inst Parasitol, Winterthurerstr 266A, CH-8057 Zurich, Switzerland; [Blanckenhorn, Wolf U.] Univ Zurich, Dept Evolutionary Biol & Environm Studies, Zurich, Switzerland","Verhulst, NO (corresponding author), Univ Zurich, Vetsuisse Fac, Natl Ctr Vector Entomol, Inst Parasitol, Winterthurerstr 266A, CH-8057 Zurich, Switzerland.",Niels.Verhulst@uzh.ch,,"Verhulst, Niels/0000-0002-1106-9711",Swiss Federal Food Safety and Veterinary Office of the Swiss National Centre for Vector Entomology,We thank Jeannine Hauri for mosquito rearing. We highly acknowledge the Swiss Federal Food Safety and Veterinary Office as sponsor of the Swiss National Centre for Vector Entomology.,,35,0,0,2,2,PERGAMON-ELSEVIER SCIENCE LTD,OXFORD,"THE BOULEVARD, LANGFORD LANE, KIDLINGTON, OXFORD OX5 1GB, ENGLAND",0306-4565,,,J THERM BIOL,J. Therm. Biol.,JUL,2020,91,,,,,,,,102637,10.1016/j.jtherbio.2020.102637,,,10,Biology; Zoology,Life Sciences & Biomedicine - Other Topics; Zoology,MQ4AW,WOS:000552838300025,32716879,,,,2020-12-20,
J,"Eastwood, G; Sang, RC; Lutomiah, J; Tunge, P; Weaver, SC",,,,"Eastwood, Gillian; Sang, Rosemary C.; Lutomiah, Joel; Tunge, Philip; Weaver, Scott C.",,,Sylvatic Mosquito Diversity in Kenya-Considering Enzootic Ecology of Arboviruses in an Era of Deforestation,INSECTS,,,English,Article,,,,,,mosquito; disease; vector; East Africa; arbovirus; Sylvatic; species diversity; distribution; emerging,WEST NILE VIRUS; CHIKUNGUNYA-VIRUS; DIPTERA-CULICIDAE; FAMILY BUNYAVIRIDAE; HEMORRHAGIC-FEVER; DENGUE VIRUS; TRANSMISSION; VECTOR; DISTRICT; MALARIA,"As new and re-emerging vector-borne diseases are occurring across the world, East Africa represents an interesting location, being the origin of several arboviruses with a history of urbanization and global spread. Rapid expansion of urban populations and alteration of natural habitats creates the opportunity for arboviruses to host-switch from wild, sylvatic hosts or vectors into urban transmission affecting human populations. Although mosquito surveillance regularly takes place in urban areas of Kenya, for example identifying vectors of dengue virus or malaria viruses, little work has been carried out to determine the distribution and abundance of sylvatic vectors. Here, we describe the mosquito vector species and diversity collected at twelve forest habitats of rural Kenya. We conducted arbovirus screening of over 14,082 mosquitoes (47 species, 11 genera) as 1520 pools, and detected seven viruses (six bunyaviruses, and one flavivirus-bunyavirus co-infection) isolated from pools ofAedes dentatus,Anopheles funestus,Culex annulioris,andCx. vansomereni. Awareness of sylvatic vector species and their location is a critical part of understanding the ecological foci and enzootic cycling of pathogens that may be of concern to public, animal or wildlife health. As natural ecosystems come under anthropogenic pressures, such knowledge can inform us of the One Health potential for spillover or spillback leading to outbreaks, and assist in vector control strategies.","[Eastwood, Gillian] Univ Texas Med Branch, Dept Microbiol & Immunol, Ctr Trop Dis, Inst Human Infect & Immun, Galveston, TX 77555 USA; [Eastwood, Gillian] Virginia Tech, Coll Agr & Life Sci, Blacksburg, VA 24060 USA; [Sang, Rosemary C.; Lutomiah, Joel; Tunge, Philip] Kenya Govt Med Res Ctr, Ctr Viral Res, Mbagathi Way, Nairobi, Kenya; [Weaver, Scott C.] Univ Texas Med Branch, Dept Microbiol & Immunol, World Reference Ctr Emerging Viruses & Arboviruse, Inst Human Infect & Immun,Ctr Trop Dis, Galveston, TX 77555 USA","Eastwood, G (corresponding author), Univ Texas Med Branch, Dept Microbiol & Immunol, Ctr Trop Dis, Inst Human Infect & Immun, Galveston, TX 77555 USA.; Eastwood, G (corresponding author), Virginia Tech, Coll Agr & Life Sci, Blacksburg, VA 24060 USA.",geastwood@vt.edu; Rosemary.Sang@usamru-k.org; joel.lutomiah@usamru-k.org; tungephilip@gmail.com; sweaver@utmb.edu,"; Weaver, Scott/D-6490-2011","Eastwood, Gillian/0000-0002-9683-0353; Weaver, Scott/0000-0001-8016-8556","University of Texas Medical Branch at Galveston; UTMB Institute for Human Infections and Immunity; World Reference Center for Emerging Viruses and Arboviruses, NIH grantUnited States Department of Health & Human ServicesNational Institutes of Health (NIH) - USA [R24AI120942]","A McLaughlin Endowment Post-Doctoral Fellowship awarded to G.E. from the University of Texas Medical Branch at Galveston supported this work. The research was also aided by the UTMB Institute for Human Infections and Immunity, and by the World Reference Center for Emerging Viruses and Arboviruses, NIH grant R24AI120942.",,58,0,0,0,0,MDPI,BASEL,"ST ALBAN-ANLAGE 66, CH-4052 BASEL, SWITZERLAND",,2075-4450,,INSECTS,Insects,JUN,2020,11,6,,,,,,,342,10.3390/insects11060342,,,13,Entomology,Entomology,MT1PQ,WOS:000554740600001,32503123,"DOAJ Gold, Green Published",,,2020-12-20,
J,"Leschnik, M",,,,"Leschnik, Michael",,,FOCUS ON COMMON SMALL ANIMAL VECTOR-BORNE DISEASES IN CENTRAL AND SOUTHEASTERN EUROPE,ACTA VETERINARIA-BEOGRAD,,,English,Review,,,,,,canine babesiosis; diagnostic procedures; dirofilariosis; leishmaniosis; tick-borne encephalitis,BABESIA-CANIS-CANIS; DIROFILARIA-IMMITIS; ENCEPHALITIS-VIRUS; IXODES-RICINUS; GEOGRAPHIC-DISTRIBUTION; PHLEBOTOMINE SANDFLIES; HEARTWORM DISEASE; HEALTHY DOGS; LEISHMANIASIS; PREVALENCE,"Vector-borne diseases are one of the main causes of morbidity and mortality in small animals in Europe. Many of these diseases are well-known among veterinary practitioners and some of them are called emerging diseases as prevalence, temporal and spatial distribution seem to increase in Europe. The number of newly recognized pathogens, transmitted by a variety of arthropod vectors, that are relevant for dogs and cats, is also increasing every year. The prevalence among infected vectors and hosts is a hot topic in veterinary science throughout the entire continent, as well as the development of efficient diagnostic procedures, therapy and prophylactic measures. Companion animal vector-borne diseases comprise a large group of pathogens including viruses, bacteria, protozoa and helminths. These pathogens are mainly transmitted by bloodsucking arthropods (ticks, fleas, mosquitos, sand flies), and more seldom by direct transmission between vertebrate hosts. Vector prevalence and activity is influenced by local climate conditions, host species density, changes in landscape and land use. Human parameters such as poverty and migration affect the use of prophylactic measures against pathogen transmission and infection as well as increasing the zoonotic risk to introducing pathogens by infected humans. Small animal associated factors such as pet trade and pet travel spread infection and certain vectors such as ticks and fleas. All these factors pose several complex and significant challenges for veterinarians in clinical practice to decide on efficient laboratory work-up and constructive diagnostic procedures.","[Leschnik, Michael] Vet Univ Vienna, Small Anim Clin, Vet Pl 1, A-1210 Vienna, Austria","Leschnik, M (corresponding author), Vet Univ Vienna, Small Anim Clin, Vet Pl 1, A-1210 Vienna, Austria.",michael.leschnik@vetmeduni.ac.at,,,,,,104,0,0,7,7,SCIENDO,WARSAW,"BOGUMILA ZUGA 32A, WARSAW, MAZOVIA, POLAND",0567-8315,1820-7448,,ACTA VET-BEOGRAD,Acta Vet.-Beogr.,JUN,2020,70,2,,,,,147,169,,10.2478/acve-2020-0011,,,23,Veterinary Sciences,Veterinary Sciences,LY9LP,WOS:000540849900001,,DOAJ Gold,,,2020-12-20,
J,"Sun, XM; Hua, S; Gao, C; Blackmer, JE; Ouyang, ZY; Ard, K; Ciaranello, A; Yawetz, S; Sax, PE; Rosenberg, ES; Lichterfeld, M; Yu, XG",,,,"Sun, Xiaoming; Hua, Stephane; Gao, Ce; Blackmer, Jane E.; Ouyang, Zhengyu; Ard, Kevin; Ciaranello, Andrea; Yawetz, Sigal; Sax, Paul E.; Rosenberg, Eric S.; Lichterfeld, Mathias; Yu, Xu G.",,,Immune-profiling of ZIKV-infected patients identifies a distinct function of plasmacytoid dendritic cells for immune cross-regulation,NATURE COMMUNICATIONS,,,English,Article,,,,,,,VIRUS-INFECTION; I INTERFERON; DNA VACCINE; ANTIBODIES; INNATE; IMMUNOGENICITY; REPLICATION; PHASE-1; BIOLOGY; PROTEIN,"Zika virus (ZIKV) is a mosquito-borne pathogen with increasing public health significance. To characterize immune responses to ZIKV, here we examine transcriptional signatures of CD4 T, CD8 T, B, and NK cells, monocytes, myeloid dendritic cells (mDCs), and plasmacytoid dendritic cells (pDCs) from three individuals with ZIKV infection. While gene expression patterns from most cell subsets display signs of impaired antiviral immune activity, pDCs from infected host have distinct transcriptional response associated with activation of innate immune recognition and type I interferon signaling pathways, but downregulation of key host factors known to support ZIKV replication steps; meanwhile, pDCs exhibit a unique expression pattern of gene modules that are correlated with alternative cell populations, suggesting collaborative interactions between pDCs and other immune cells, particularly B cells. Together, these results point towards a discrete but integrative function of pDCs in the human immune responses to ZIKV infection. Zika virus (ZIKV) poses a significant public health threat, but the immune landscape changes following ZIKV infection is still unclear. Here, the authors show, using flow cytometry and transcriptomic data, that ZIKV induces a multitude of immune responses, with plasmacytoid dendritic cells poised centrally to interact with other immune cell types.","[Sun, Xiaoming; Hua, Stephane; Gao, Ce; Blackmer, Jane E.; Ouyang, Zhengyu; Lichterfeld, Mathias; Yu, Xu G.] Massachusetts Gen Hosp, Ragon Inst MGH MIT & Harvard, Boston, MA 02114 USA; [Ard, Kevin; Ciaranello, Andrea; Rosenberg, Eric S.] Massachusetts Gen Hosp, Infect Dis Div, Boston, MA 02114 USA; [Yawetz, Sigal; Sax, Paul E.; Lichterfeld, Mathias; Yu, Xu G.] Brigham & Womens Hosp, Infect Dis Div, 75 Francis St, Boston, MA 02115 USA","Yu, XG (corresponding author), Massachusetts Gen Hosp, Ragon Inst MGH MIT & Harvard, Boston, MA 02114 USA.; Yu, XG (corresponding author), Brigham & Womens Hosp, Infect Dis Div, 75 Francis St, Boston, MA 02115 USA.",xyu@mgh.harvard.edu,,,"NIHUnited States Department of Health & Human ServicesNational Institutes of Health (NIH) - USA [AI078799, AI089339, HL121890, AI098484, HL126554, AI116228, AI087452]; Sundry fund from the Ragon Institute of MGH, MIT, and Harvard","X.G.Y. is supported by NIH (grants AI078799, AI089339, HL121890, AI098484, HL126554, AI116228, and AI087452) and by a Sundry fund from the Ragon Institute of MGH, MIT, and Harvard.",,69,2,2,0,0,NATURE PUBLISHING GROUP,LONDON,"MACMILLAN BUILDING, 4 CRINAN ST, LONDON N1 9XW, ENGLAND",2041-1723,,,NAT COMMUN,Nat. Commun.,MAY 15,2020,11,1,,,,,,,2421,10.1038/s41467-020-16217-5,,,13,Multidisciplinary Sciences,Science & Technology - Other Topics,LS7OG,WOS:000536569900019,32415086,"DOAJ Gold, Green Published",,,2020-12-20,
